experiment_mode,strategy_archetype,profit_wins,balanced_wins,service_wins,forecast_wins,cash_wins,innovation_wins,average_final_profit,average_final_revenue,average_final_cash,average_final_debt,average_service_level,average_forecast_accuracy,average_balanced_score,average_profit_rank,average_balanced_rank,main_strength,main_weakness
calibrated,Premium quality,3,6,5,6,3,16,51141.89,216923.09,78285.89,0.0,0.591,0.5356,60.6,3.1,2.65,Produces strong service/forecast outcomes when customers reward reliability.,High quality and sourcing costs can overwhelm revenue if demand is not premium enough.
calibrated,Cash conservative,8,4,1,2,8,0,95264.21,244105.18,120848.21,0.0,0.3943,0.3539,53.8,1.95,2.7,"Protects liquidity, avoids debt, and limits self-inflicted operating risk.",May under-serve demand in boom markets and can look too cautious.
calibrated,Balanced S&OP,5,4,3,1,5,0,64248.47,471820.27,110635.47,17203.0,0.5849,0.5166,65.0,2.3,2.3,"Keeps forecast, production, sourcing, and service decisions relatively aligned.",Can carry enough borrowing or investment burden to weaken liquidity.
calibrated,Low-cost volume,3,3,9,11,3,0,32270.04,370180.4,98445.14,40591.1,0.6007,0.5336,56.8,3.5,3.35,Can serve high-volume beginner demand when margins remain protected.,"Thin margins, defects, and inventory cost can erase volume benefits."
calibrated,Innovation leap,0,2,2,0,0,4,-20852.46,228241.97,84595.09,76215.55,0.5327,0.3731,12.6,5.25,5.25,Builds future technology position and can benefit in fast technology shifts.,Large NPD investment can create debt and weak short-term service.
calibrated,Aggressive growth,1,1,0,0,1,0,-28595.83,407552.76,103285.5,108841.32,0.5489,0.4556,22.6,4.9,4.75,Can chase demand upside when capacity and working capital are available.,"Expansion, overtime, and inventory can destroy cash if demand or margins disappoint."
